{"$schema":"https://json-schema.org/draft/2020-12/schema","$id":"https://mindclade.dev/schemas/configuration/v1","title":"Configuration","type":"object","additionalProperties":false,"required":["schema_version","kind","metadata","spec","lineage","integrity"],"properties":{"schema_version":{"const":"mindclade.configuration/v1"},"kind":{"const":"Configuration"},"metadata":{"$ref":"#/$defs/metadata"},"spec":{"type":"object","additionalProperties":false,"required":["resolved_digest","values","redacted_paths"],"properties":{"resolved_digest":{"$ref":"#/$defs/digest"},"values":{"type":"object","propertyNames":{"pattern":"^(?!.*(secret|token|password)).*$"}},"redacted_paths":{"type":"array","items":{"type":"string"}}}},"lineage":{"type":"array","items":{"$ref":"#/$defs/digest"}},"integrity":{"$ref":"#/$defs/integrity"}},"$defs":{"digest":{"type":"string","pattern":"^sha256:[a-f0-9]{64}$"},"metadata":{"type":"object","additionalProperties":false,"required":["uid","created_at","owner"],"properties":{"uid":{"type":"string","minLength":1},"created_at":{"type":"string","format":"date-time"},"owner":{"type":"string","minLength":1}}},"integrity":{"type":"object","additionalProperties":false,"required":["payload_digest","signatures"],"properties":{"payload_digest":{"$ref":"#/$defs/digest"},"signatures":{"type":"array","items":{"type":"string","minLength":1}}}}}}
