{"schema_version":"mindclade.configuration/v1","kind":"Configuration","metadata":{"uid":"configuration-1","created_at":"2026-08-30T00:00:00Z","owner":"platform"},"spec":{"resolved_digest":"sha256:aaaaaaaaaaaaaaaaaaaaaaaaaaaaaaaaaaaaaaaaaaaaaaaaaaaaaaaaaaaaaaaa","values":{"mode":"fixture"},"redacted_paths":["credentials.token"]},"lineage":[],"integrity":{"payload_digest":"sha256:bbbbbbbbbbbbbbbbbbbbbbbbbbbbbbbbbbbbbbbbbbbbbbbbbbbbbbbbbbbbbbbb","signatures":[]}}
